{
  "diagnostic_id": "diag-002",
  "surface_id": "watcher-surface-001",
  "surface_class": "watcher_status",
  "scope_ref": "watch_scope:contract-001",
  "state": "ready",
  "watcher_summary": {
    "active_watch_scope_count": 1,
    "contract_scoped_only": true,
    "operator_visible_summary": "One contract-scoped watcher is active."
  },
  "allowed_controls": [
    "disable_watcher",
    "inspect_reason_codes"
  ],
  "details_redacted": true,
  "operator_visible_message": "Watcher diagnostics remain bounded, attributable, and redacted.",
  "last_updated_at": "2026-03-19T12:12:00Z"
}
